outputs_modes_v3_td/final/architecture_mode_summary.json

[
  {
    "architecture": "resnet50",
    "mode": "full",
    "completed_seeds": 5,
    "test_acc_mean": 0.9364705882352942,
    "test_acc_sample_sd": 0.013413828530578084,
    "test_macro_precision_mean": 0.929231017120807,
    "test_macro_precision_sample_sd": 0.020663497120465345,
    "test_macro_recall_mean": 0.927718253968254,
    "test_macro_recall_sample_sd": 0.01690403850965437,
    "test_macro_f1_mean": 0.9255882747015869,
    "test_macro_f1_sample_sd": 0.018093972215695468
  },
  {
    "architecture": "resnet50",
    "mode": "frozen",
    "completed_seeds": 5,
    "test_acc_mean": 0.8847058823529412,
    "test_acc_sample_sd": 0.015339299776947408,
    "test_macro_precision_mean": 0.8793371725054472,
    "test_macro_precision_sample_sd": 0.017221566572160125,
    "test_macro_recall_mean": 0.8764682539682539,
    "test_macro_recall_sample_sd": 0.01588109758298485,
    "test_macro_f1_mean": 0.8755290319258535,
    "test_macro_f1_sample_sd": 0.016674942129007494
  },
  {
    "architecture": "resnet50",
    "mode": "partial",
    "completed_seeds": 5,
    "test_acc_mean": 0.931764705882353,
    "test_acc_sample_sd": 0.015339299776947401,
    "test_macro_precision_mean": 0.9239347600041334,
    "test_macro_precision_sample_sd": 0.016251128460273854,
    "test_macro_recall_mean": 0.9210813492063492,
    "test_macro_recall_sample_sd": 0.017960527993105664,
    "test_macro_f1_mean": 0.9182447150812404,
    "test_macro_f1_sample_sd": 0.020900973989037546
  },
  {
    "architecture": "efficientnet_b0",
    "mode": "full",
    "completed_seeds": 5,
    "test_acc_mean": 0.9105882352941176,
    "test_acc_sample_sd": 0.013413828530578084,
    "test_macro_precision_mean": 0.8998223396381965,
    "test_macro_precision_sample_sd": 0.014286092055982382,
    "test_macro_recall_mean": 0.8925099206349207,
    "test_macro_recall_sample_sd": 0.015341541014014292,
    "test_macro_f1_mean": 0.8920694909035909,
    "test_macro_f1_sample_sd": 0.01520941888844137
  },
  {
    "architecture": "efficientnet_b0",
    "mode": "frozen",
    "completed_seeds": 5,
    "test_acc_mean": 0.8564705882352941,
    "test_acc_sample_sd": 0.024110472390493146,
    "test_macro_precision_mean": 0.8365830474052286,
    "test_macro_precision_sample_sd": 0.026236404971013073,
    "test_macro_recall_mean": 0.8378174603174603,
    "test_macro_recall_sample_sd": 0.023007602552439263,
    "test_macro_f1_mean": 0.8338015527999423,
    "test_macro_f1_sample_sd": 0.023567177817211793
  },
  {
    "architecture": "efficientnet_b0",
    "mode": "partial",
    "completed_seeds": 5,
    "test_acc_mean": 0.9270588235294118,
    "test_acc_sample_sd": 0.021045345670586225,
    "test_macro_precision_mean": 0.9166415589241677,
    "test_macro_precision_sample_sd": 0.02639057784327429,
    "test_macro_recall_mean": 0.9129464285714286,
    "test_macro_recall_sample_sd": 0.024627988678684164,
    "test_macro_f1_mean": 0.9104776862664863,
    "test_macro_f1_sample_sd": 0.026743052579944727
  },
  {
    "architecture": "mobilenet_v3_large",
    "mode": "full",
    "completed_seeds": 5,
    "test_acc_mean": 0.9176470588235294,
    "test_acc_sample_sd": 0.008318903308077039,
    "test_macro_precision_mean": 0.9145365651383959,
    "test_macro_precision_sample_sd": 0.01569977093036089,
    "test_macro_recall_mean": 0.9039682539682538,
    "test_macro_recall_sample_sd": 0.008487797474685494,
    "test_macro_f1_mean": 0.8985848264767305,
    "test_macro_f1_sample_sd": 0.00958808689934307
  },
  {
    "architecture": "mobilenet_v3_large",
    "mode": "frozen",
    "completed_seeds": 5,
    "test_acc_mean": 0.9035294117647059,
    "test_acc_sample_sd": 0.00984305913569497,
    "test_macro_precision_mean": 0.8913532720140271,
    "test_macro_precision_sample_sd": 0.009313639208594194,
    "test_macro_recall_mean": 0.8922619047619047,
    "test_macro_recall_sample_sd": 0.011224465191142145,
    "test_macro_f1_mean": 0.8869147383220861,
    "test_macro_f1_sample_sd": 0.013307918102285377
  },
  {
    "architecture": "mobilenet_v3_large",
    "mode": "partial",
    "completed_seeds": 5,
    "test_acc_mean": 0.9317647058823528,
    "test_acc_sample_sd": 0.02411047239049313,
    "test_macro_precision_mean": 0.9271071085982413,
    "test_macro_precision_sample_sd": 0.020417929668609787,
    "test_macro_recall_mean": 0.9217460317460316,
    "test_macro_recall_sample_sd": 0.02664705439039285,
    "test_macro_f1_mean": 0.916795686949946,
    "test_macro_f1_sample_sd": 0.030513527857382813
  },
  {
    "architecture": "densenet121",
    "mode": "full",
    "completed_seeds": 5,
    "test_acc_mean": 0.9270588235294118,
    "test_acc_sample_sd": 0.01533929977694741,
    "test_macro_precision_mean": 0.9201919919232143,
    "test_macro_precision_sample_sd": 0.019340195196486977,
    "test_macro_recall_mean": 0.9144345238095237,
    "test_macro_recall_sample_sd": 0.018506704470414307,
    "test_macro_f1_mean": 0.9126810888089352,
    "test_macro_f1_sample_sd": 0.018924903489695794
  },
  {
    "architecture": "densenet121",
    "mode": "frozen",
    "completed_seeds": 5,
    "test_acc_mean": 0.8800000000000001,
    "test_acc_sample_sd": 0.012887589588356865,
    "test_macro_precision_mean": 0.8637053098951573,
    "test_macro_precision_sample_sd": 0.01729851308160057,
    "test_macro_recall_mean": 0.8586309523809523,
    "test_macro_recall_sample_sd": 0.01571195726145423,
    "test_macro_f1_mean": 0.8586657826612385,
    "test_macro_f1_sample_sd": 0.016482414085385724
  },
  {
    "architecture": "densenet121",
    "mode": "partial",
    "completed_seeds": 5,
    "test_acc_mean": 0.9270588235294118,
    "test_acc_sample_sd": 0.017449878793166253,
    "test_macro_precision_mean": 0.9180548111346335,
    "test_macro_precision_sample_sd": 0.0209669315332345,
    "test_macro_recall_mean": 0.9149305555555557,
    "test_macro_recall_sample_sd": 0.019965662891878753,
    "test_macro_f1_mean": 0.9141994734014613,
    "test_macro_f1_sample_sd": 0.018525848259047722
  },
  {
    "architecture": "convnext_tiny",
    "mode": "full",
    "completed_seeds": 5,
    "test_acc_mean": 0.9294117647058824,
    "test_acc_sample_sd": 0.01663780661615404,
    "test_macro_precision_mean": 0.923603132501874,
    "test_macro_precision_sample_sd": 0.019384098397318486,
    "test_macro_recall_mean": 0.9178571428571429,
    "test_macro_recall_sample_sd": 0.0189585383898274,
    "test_macro_f1_mean": 0.9134719878085132,
    "test_macro_f1_sample_sd": 0.02121420008237153
  },
  {
    "architecture": "convnext_tiny",
    "mode": "frozen",
    "completed_seeds": 5,
    "test_acc_mean": 0.8705882352941178,
    "test_acc_sample_sd": 0.027590680940137828,
    "test_macro_precision_mean": 0.8614207556092174,
    "test_macro_precision_sample_sd": 0.035230517583173034,
    "test_macro_recall_mean": 0.8565972222222221,
    "test_macro_recall_sample_sd": 0.02693052694043259,
    "test_macro_f1_mean": 0.8517497082227482,
    "test_macro_f1_sample_sd": 0.024808621316914675
  },
  {
    "architecture": "convnext_tiny",
    "mode": "partial",
    "completed_seeds": 5,
    "test_acc_mean": 0.9199999999999999,
    "test_acc_sample_sd": 0.01533929977694741,
    "test_macro_precision_mean": 0.9205132849440251,
    "test_macro_precision_sample_sd": 0.01456782509072284,
    "test_macro_recall_mean": 0.9079563492063493,
    "test_macro_recall_sample_sd": 0.017189078210370214,
    "test_macro_f1_mean": 0.9074145317220742,
    "test_macro_f1_sample_sd": 0.01779169176694443
  }
]

README.md

### 6.3 Test performance

**ResNet50/Full มีค่าเฉลี่ยสูงสุดทั้ง 4 classification metrics จาก 15 setups** ได้แก่ Accuracy 93.65%, Macro precision 92.92%, Macro recall 92.77% และ Macro F1 92.56% ผลจึงสนับสนุนการเลือกจากหลายด้านร่วมกัน ตารางแสดง mean (%) ± sample SD (pp) จาก 5 seeds เรียงตาม Macro F1

### 6.10 Ablation study of ResNet50/Full

ผลรายคลาสมีข้อแลกเปลี่ยน: Recall ของพระภูมิลดจาก 77.78% เป็น 74.44% ในทั้งสอง variants แต่ Precision ของคลาสนี้ในกรณีไม่ใช้ class weights เพิ่มจาก 92.17% เป็น 95.00% คงเลือกสูตร baseline (มีทั้ง augmentation และ class weights) และไม่นำผล ablation ไปปรับ hyperparameters